<?xml version="1.0" encoding="UTF-8"?>
<tns:CubeDef xsi:schemaLocation="http://www.guavus.com/CubeDefinition CubeDefinition.xsd" xmlns:tns="http://www.guavus.com/CubeDefinition" xmlns:xsi="http://www.w3.org/2001/XMLSchema-instance">

<!--Fields-->

    <!--Dimension Fields-->

    <tns:RefField FieldName="APP_CATEGORY">
        <tns:String2Id>true</tns:String2Id>
        <tns:Type>Generic</tns:Type>
        <tns:DataType>Int</tns:DataType>
    </tns:RefField>
    <tns:RefField FieldName="TT_APP_CAT">
        <tns:String2Id>true</tns:String2Id>
        <tns:Type>Generic</tns:Type>
        <tns:DataType>Int</tns:DataType>
    </tns:RefField>
    <tns:RefField FieldName="APP_TYPE">
        <tns:String2Id>true</tns:String2Id>
        <tns:Type>Generic</tns:Type>
        <tns:DataType>Int</tns:DataType>
    </tns:RefField>
    <tns:RefField FieldName="GGSN">
        <tns:String2Id>true</tns:String2Id>
        <tns:Type>Generic</tns:Type>
        <tns:DataType>Int</tns:DataType>
    </tns:RefField>
    <tns:RefField FieldName="RAT">
        <tns:String2Id>true</tns:String2Id>
        <tns:Type>Generic</tns:Type>
        <tns:DataType>Int</tns:DataType>
    </tns:RefField>
    <tns:RefField FieldName="SEGMENT">
        <tns:String2Id>true</tns:String2Id>
        <tns:Type>Generic</tns:Type>
        <tns:DataType>Int</tns:DataType>
    </tns:RefField>
    <tns:RefField FieldName="URL_CATEGORY">
        <tns:String2Id>true</tns:String2Id>
        <tns:Type>Generic</tns:Type>
        <tns:DataType>Int</tns:DataType>
    </tns:RefField>
    <tns:RefField FieldName="SP">
        <tns:String2Id>true</tns:String2Id>
        <tns:Type>Generic</tns:Type>
        <tns:DataType>Int</tns:DataType>
    </tns:RefField>
    <tns:RefField FieldName="DC">
        <tns:String2Id>true</tns:String2Id>
        <tns:Type>Generic</tns:Type>
        <tns:DataType>Int</tns:DataType>
    </tns:RefField>
    <tns:RefField FieldName="SGSN">
        <tns:String2Id>true</tns:String2Id>
        <tns:Type>Generic</tns:Type>
        <tns:DataType>Int</tns:DataType>
    </tns:RefField>
    <tns:RefField FieldName="CELL_SECTOR">
        <tns:String2Id>true</tns:String2Id>
        <tns:Type>Generic</tns:Type>
        <tns:DataType>Int</tns:DataType>
    </tns:RefField>
    <tns:RefField FieldName="APN">
        <tns:String2Id>true</tns:String2Id>
        <tns:Type>Generic</tns:Type>
        <tns:DataType>Int</tns:DataType>
    </tns:RefField>
    <tns:RefField FieldName="DEVICE">
        <tns:String2Id>true</tns:String2Id>
        <tns:Type>Generic</tns:Type>
        <tns:DataType>Int</tns:DataType>
    </tns:RefField>
    <tns:RefField FieldName="SUBCR">
        <tns:String2Id>true</tns:String2Id>
        <tns:Type>Generic</tns:Type>
        <tns:DataType>Int</tns:DataType>
    </tns:RefField>
    <tns:RefField FieldName="APP">
        <tns:String2Id>true</tns:String2Id>
        <tns:Type>Generic</tns:Type>
        <tns:DataType>Int</tns:DataType>
    </tns:RefField>
    <tns:RefField FieldName="TT_APP">
        <tns:String2Id>true</tns:String2Id>
        <tns:Type>Generic</tns:Type>
        <tns:DataType>Int</tns:DataType>
    </tns:RefField>
    <tns:RefField FieldName="RNC">
        <tns:String2Id>true</tns:String2Id>
        <tns:Type>Generic</tns:Type>
        <tns:DataType>Int</tns:DataType>
    </tns:RefField>

    <tns:RefField FieldName="ByteArr">
        <tns:String2Id>false</tns:String2Id>
        <tns:Type>ByteArray</tns:Type>
        <tns:DataType>Varbinary</tns:DataType>
        <tns:ColumnWidth>4104</tns:ColumnWidth>
    </tns:RefField>
    <tns:RefField FieldName="LargeByteArr">
        <tns:String2Id>false</tns:String2Id>
        <tns:Type>ByteArray</tns:Type>
        <tns:DataType>Varbinary</tns:DataType>
        <tns:ColumnWidth>2048</tns:ColumnWidth>
    </tns:RefField>
    <tns:RefField FieldName="Source">
        <tns:String2Id>true</tns:String2Id>
        <tns:Type>Generic</tns:Type>
        <tns:DataType>Int</tns:DataType>
    </tns:RefField>
    <tns:RefField FieldName="DimensionListContainsSubscriber">
        <tns:String2Id>false</tns:String2Id>
        <tns:Type>Generic</tns:Type>
        <tns:DataType>Int</tns:DataType>
    </tns:RefField>

    <!--Measure Fields-->

    <tns:RefField FieldName="f_PEAK_FLOW_DUR">
        <tns:String2Id>true</tns:String2Id>
        <tns:Type>Generic</tns:Type>
        <tns:DataType>Double</tns:DataType>
    </tns:RefField>
    <tns:RefField FieldName="f_FLOW_DURATION">
        <tns:String2Id>true</tns:String2Id>
        <tns:Type>Generic</tns:Type>
        <tns:DataType>Double</tns:DataType>
    </tns:RefField>
    <tns:RefField FieldName="f_SESSION_DUR">
        <tns:String2Id>true</tns:String2Id>
        <tns:Type>Generic</tns:Type>
        <tns:DataType>Double</tns:DataType>
    </tns:RefField>
    <tns:RefField FieldName="f_FLOW_COUNT">
        <tns:String2Id>true</tns:String2Id>
        <tns:Type>Generic</tns:Type>
        <tns:DataType>Double</tns:DataType>
    </tns:RefField>
    <tns:RefField FieldName="f_UP_BYTES">
        <tns:String2Id>true</tns:String2Id>
        <tns:Type>Generic</tns:Type>
        <tns:DataType>Double</tns:DataType>
    </tns:RefField>
    <tns:RefField FieldName="f_DOWN_BYTES">
        <tns:String2Id>true</tns:String2Id>
        <tns:Type>Generic</tns:Type>
        <tns:DataType>Double</tns:DataType>
    </tns:RefField>
    <tns:RefField FieldName="f_SESSION_COUNT">
        <tns:String2Id>true</tns:String2Id>
        <tns:Type>Generic</tns:Type>
        <tns:DataType>Double</tns:DataType>
    </tns:RefField>
    <tns:RefField FieldName="f_SUBCR_COUNT">
        <tns:String2Id>true</tns:String2Id>
        <tns:Type>Generic</tns:Type>
        <tns:DataType>Double</tns:DataType>
    </tns:RefField>
    <tns:RefField FieldName="f_HIT_COUNT">
        <tns:String2Id>true</tns:String2Id>
        <tns:Type>Generic</tns:Type>
        <tns:DataType>Double</tns:DataType>
    </tns:RefField>
    <tns:RefField FieldName="f_CONC_HIT">
        <tns:String2Id>true</tns:String2Id>
        <tns:Type>Generic</tns:Type>
        <tns:DataType>Double</tns:DataType>
    </tns:RefField>
    <tns:RefField FieldName="f_CONC_SESSION">
        <tns:String2Id>true</tns:String2Id>
        <tns:Type>Generic</tns:Type>
        <tns:DataType>Double</tns:DataType>
    </tns:RefField>
    <tns:RefField FieldName="f_HIT_DURATION">
        <tns:String2Id>true</tns:String2Id>
        <tns:Type>Generic</tns:Type>
        <tns:DataType>Double</tns:DataType>
    </tns:RefField>
    <tns:RefField FieldName="f_PEAK_HIT_DUR">
        <tns:String2Id>true</tns:String2Id>
        <tns:Type>Generic</tns:Type>
        <tns:DataType>Double</tns:DataType>
    </tns:RefField>
    <tns:RefField FieldName="f_CONC_FLOW">
        <tns:String2Id>true</tns:String2Id>
        <tns:Type>Generic</tns:Type>
        <tns:DataType>Double</tns:DataType>
    </tns:RefField>

    <!--Measures-->
    
    <tns:RefMeasure MeasureName="PEAK_FLOW_DUR">
        <tns:Function>Maximum</tns:Function>
        <tns:Field Field="f_PEAK_FLOW_DUR"/>
    </tns:RefMeasure>

    <tns:RefMeasure MeasureName="FLOW_DURATION">
        <tns:Function>Summation</tns:Function>
        <tns:Field Field="f_FLOW_DURATION"/>
    </tns:RefMeasure>

    <tns:RefMeasure MeasureName="SESSION_DUR">
        <tns:Function>Summation</tns:Function>
        <tns:Field Field="f_SESSION_DUR"/>
    </tns:RefMeasure>

    <tns:RefMeasure MeasureName="FLOW_COUNT">
        <tns:Function>Summation</tns:Function>
        <tns:Field Field="f_FLOW_COUNT"/>
    </tns:RefMeasure>

    <tns:RefMeasure MeasureName="UP_BYTES">
        <tns:Function>Summation</tns:Function>
        <tns:Field Field="f_UP_BYTES"/>
    </tns:RefMeasure>

    <tns:RefMeasure MeasureName="DOWN_BYTES">
        <tns:Function>Summation</tns:Function>
        <tns:Field Field="f_DOWN_BYTES"/>
    </tns:RefMeasure>

    <tns:RefMeasure MeasureName="SESSION_COUNT">
        <tns:Function>Summation</tns:Function>
        <tns:Field Field="f_SESSION_COUNT"/>
    </tns:RefMeasure>

    <tns:RefMeasure MeasureName="HIT_COUNT">
        <tns:Function>Summation</tns:Function>
        <tns:Field Field="f_HIT_COUNT"/>
    </tns:RefMeasure>
   
    <tns:RefMeasure MeasureName="PEAK_HIT_DUR">
        <tns:Function>Maximum</tns:Function>
        <tns:Field Field="f_PEAK_HIT_DUR"/>
    </tns:RefMeasure>

    <tns:RefMeasure MeasureName="HIT_DURATION">
        <tns:Function>Summation</tns:Function>
        <tns:Field Field="f_HIT_DURATION"/>
    </tns:RefMeasure>

    <tns:RefMeasure MeasureName="SUBCR_COUNT">
        <tns:Function>PCSA</tns:Function>
        <tns:StorageMode>MultiPartNonCombinable</tns:StorageMode>
        <tns:Field Field="ByteArr" Persist="true"/>
        <tns:Range Name="PCSA_AllValues" Type="ByteArray" RangeStart="MIN" RangeEnd="MAX"/>
    </tns:RefMeasure>

    <tns:RefMeasure MeasureName="CONC_FLOW">
        <tns:Function>CONC</tns:Function>
        <tns:StorageMode>MultiPartNonCombinable</tns:StorageMode>
        <tns:Field Field="LargeByteArr" Persist="true"/>
        <tns:Range Name="PCSA_AllValues" Type="ByteArray" RangeStart="MIN" RangeEnd="MAX"/>
    </tns:RefMeasure>

    <tns:RefMeasure MeasureName="CONC_HIT">
        <tns:Function>CONC</tns:Function>
        <tns:StorageMode>MultiPartNonCombinable</tns:StorageMode>
        <tns:Field Field="LargeByteArr" Persist="true"/>
        <tns:Range Name="PCSA_AllValues" Type="ByteArray" RangeStart="MIN" RangeEnd="MAX"/>
    </tns:RefMeasure>

    <tns:RefMeasure MeasureName="CONC_SESSION">
        <tns:Function>CONC</tns:Function>
        <tns:StorageMode>MultiPartNonCombinable</tns:StorageMode>
        <tns:Field Field="LargeByteArr" Persist="true"/>
        <tns:Range Name="PCSA_AllValues" Type="ByteArray" RangeStart="MIN" RangeEnd="MAX"/>
    </tns:RefMeasure>

    <!-- This is a generic PCSA measure -->
    <tns:RefMeasure MeasureName="GenericPCSAMeasure_Example">
        <tns:Function>PCSA</tns:Function>